{
  "runtime": {
    "enterOffset": 20,
    "damping": 18,
    "stiffness": 130,
    "mass": 0.7,
    "emphasisScale": 0.035
  },
  "enter": {
    "durationFrames": 14,
    "easing": "ease-out"
  },
  "reveal": {
    "durationFrames": 18,
    "easing": "ease-out"
  },
  "highlight": {
    "durationFrames": 20,
    "easing": "ease-in-out"
  },
  "focus": {
    "durationFrames": 28,
    "easing": "ease-in-out"
  },
  "count": {
    "durationFrames": 30,
    "easing": "linear"
  }
}
